[
  {
    "id": "mapping-001",
    "input": [
      {
        "process_name": "연마",
        "quantity": 87,
        "notes": "연마 공정에서 총 87건의 데이터 수집."
      },
      {
        "process_name": "가공",
        "quantity": 100,
        "notes": "가공 공정에서 총 100건의 데이터 수집."
      }
    ],
    "expected": {
      "sections": [
        {
          "clause": "8.5.1",
          "summary": "Samsung 템플릿 기준 연마 공정의 정상 생산 수량 87건에 대한 적합성 관리 승인.",
          "confidence_score": 98
        }
      ]
    },
    "metadata": {
      "template_type": "ISO9001",
      "org_name": "Samsung",
      "complexity": "low"
    }
  },
  {
    "id": "mapping-002",
    "input": [
      {
        "process_name": "포장",
        "quantity": 94,
        "notes": "포장 공정에서 총 94건의 데이터 수집."
      },
      {
        "process_name": "압출",
        "quantity": 107,
        "defect_code": "D-004",
        "notes": "압출 공정에서 총 107건의 데이터 수집."
      },
      {
        "process_name": "조립",
        "quantity": 120,
        "notes": "조립 공정에서 총 120건의 데이터 수집."
      }
    ],
    "expected": {
      "sections": [
        {
          "clause": "8.5.1",
          "summary": "SK 템플릿 기준 포장 공정의 정상 생산 수량 94건에 대한 적합성 관리 승인.",
          "confidence_score": 98
        },
        {
          "clause": "8.7",
          "summary": "SK 템플릿 기준 압출 공정에서 발생한 치수 불량 불량(D-004) 건에 대한 통제 조치 대상 식별.",
          "confidence_score": 95
        },
        {
          "clause": "10.2",
          "summary": "불량 원인 규명 및 치수 불량 재발 방지를 위한 시정 조치 프로세스 개시 필요.",
          "confidence_score": 90
        }
      ]
    },
    "metadata": {
      "template_type": "ISO9001",
      "org_name": "SK",
      "complexity": "medium"
    }
  },
  {
    "id": "mapping-003",
    "input": [
      {
        "process_name": "도색",
        "quantity": 101,
        "defect_code": "D-004",
        "notes": "도색 공정에서 총 101건의 데이터 수집."
      },
      {
        "process_name": "연마",
        "quantity": 114,
        "notes": "연마 공정에서 총 114건의 데이터 수집."
      },
      {
        "process_name": "가공",
        "quantity": 127,
        "notes": "가공 공정에서 총 127건의 데이터 수집."
      },
      {
        "process_name": "검사",
        "quantity": 140,
        "defect_code": "D-002",
        "notes": "검사 공정에서 총 140건의 데이터 수집."
      }
    ],
    "expected": {
      "sections": [
        {
          "clause": "8.5.1",
          "summary": "Hyundai 템플릿 기준 연마 공정의 정상 생산 수량 114건에 대한 적합성 관리 승인.",
          "confidence_score": 98
        },
        {
          "clause": "8.7",
          "summary": "Hyundai 템플릿 기준 도색 공정에서 발생한 치수 불량 불량(D-004) 건에 대한 통제 조치 대상 식별.",
          "confidence_score": 95
        },
        {
          "clause": "10.2",
          "summary": "불량 원인 규명 및 치수 불량 재발 방지를 위한 시정 조치 프로세스 개시 필요.",
          "confidence_score": 90
        }
      ]
    },
    "metadata": {
      "template_type": "ISO9001",
      "org_name": "Hyundai",
      "complexity": "high"
    }
  },
  {
    "id": "mapping-004",
    "input": [
      {
        "process_name": "검사",
        "quantity": 108,
        "notes": "검사 공정에서 총 108건의 데이터 수집."
      },
      {
        "process_name": "포장",
        "quantity": 121,
        "notes": "포장 공정에서 총 121건의 데이터 수집."
      }
    ],
    "expected": {
      "sections": [
        {
          "clause": "8.5.1",
          "summary": "LG 템플릿 기준 검사 공정의 정상 생산 수량 108건에 대한 적합성 관리 승인.",
          "confidence_score": 98
        }
      ]
    },
    "metadata": {
      "template_type": "ISO9001",
      "org_name": "LG",
      "complexity": "low"
    }
  },
  {
    "id": "mapping-005",
    "input": [
      {
        "process_name": "조립",
        "quantity": 115,
        "notes": "조립 공정에서 총 115건의 데이터 수집."
      },
      {
        "process_name": "도색",
        "quantity": 128,
        "defect_code": "D-002",
        "notes": "도색 공정에서 총 128건의 데이터 수집."
      },
      {
        "process_name": "연마",
        "quantity": 141,
        "notes": "연마 공정에서 총 141건의 데이터 수집."
      }
    ],
    "expected": {
      "sections": [
        {
          "clause": "8.5.1",
          "summary": "Standard 템플릿 기준 조립 공정의 정상 생산 수량 115건에 대한 적합성 관리 승인.",
          "confidence_score": 98
        },
        {
          "clause": "8.7",
          "summary": "Standard 템플릿 기준 도색 공정에서 발생한 크랙 불량(D-002) 건에 대한 통제 조치 대상 식별.",
          "confidence_score": 95
        },
        {
          "clause": "10.2",
          "summary": "불량 원인 규명 및 크랙 재발 방지를 위한 시정 조치 프로세스 개시 필요.",
          "confidence_score": 90
        }
      ]
    },
    "metadata": {
      "template_type": "ISO9001",
      "org_name": "Standard",
      "complexity": "medium"
    }
  },
  {
    "id": "mapping-006",
    "input": [
      {
        "process_name": "가공",
        "quantity": 122,
        "defect_code": "D-002",
        "notes": "가공 공정에서 총 122건의 데이터 수집."
      },
      {
        "process_name": "검사",
        "quantity": 135,
        "notes": "검사 공정에서 총 135건의 데이터 수집."
      },
      {
        "process_name": "포장",
        "quantity": 148,
        "notes": "포장 공정에서 총 148건의 데이터 수집."
      },
      {
        "process_name": "압출",
        "quantity": 161,
        "defect_code": "D-005",
        "notes": "압출 공정에서 총 161건의 데이터 수집."
      }
    ],
    "expected": {
      "sections": [
        {
          "clause": "8.5.1",
          "summary": "Samsung 템플릿 기준 검사 공정의 정상 생산 수량 135건에 대한 적합성 관리 승인.",
          "confidence_score": 98
        },
        {
          "clause": "8.7",
          "summary": "Samsung 템플릿 기준 가공 공정에서 발생한 크랙 불량(D-002) 건에 대한 통제 조치 대상 식별.",
          "confidence_score": 95
        },
        {
          "clause": "10.2",
          "summary": "불량 원인 규명 및 크랙 재발 방지를 위한 시정 조치 프로세스 개시 필요.",
          "confidence_score": 90
        }
      ]
    },
    "metadata": {
      "template_type": "ISO9001",
      "org_name": "Samsung",
      "complexity": "high"
    }
  },
  {
    "id": "mapping-007",
    "input": [
      {
        "process_name": "압출",
        "quantity": 129,
        "notes": "압출 공정에서 총 129건의 데이터 수집."
      },
      {
        "process_name": "조립",
        "quantity": 142,
        "notes": "조립 공정에서 총 142건의 데이터 수집."
      }
    ],
    "expected": {
      "sections": [
        {
          "clause": "8.5.1",
          "summary": "SK 템플릿 기준 압출 공정의 정상 생산 수량 129건에 대한 적합성 관리 승인.",
          "confidence_score": 98
        }
      ]
    },
    "metadata": {
      "template_type": "ISO9001",
      "org_name": "SK",
      "complexity": "low"
    }
  },
  {
    "id": "mapping-008",
    "input": [
      {
        "process_name": "연마",
        "quantity": 136,
        "notes": "연마 공정에서 총 136건의 데이터 수집."
      },
      {
        "process_name": "가공",
        "quantity": 149,
        "defect_code": "D-005",
        "notes": "가공 공정에서 총 149건의 데이터 수집."
      },
      {
        "process_name": "검사",
        "quantity": 162,
        "notes": "검사 공정에서 총 162건의 데이터 수집."
      }
    ],
    "expected": {
      "sections": [
        {
          "clause": "8.5.1",
          "summary": "Hyundai 템플릿 기준 연마 공정의 정상 생산 수량 136건에 대한 적합성 관리 승인.",
          "confidence_score": 98
        },
        {
          "clause": "8.7",
          "summary": "Hyundai 템플릿 기준 가공 공정에서 발생한 이물 불량(D-005) 건에 대한 통제 조치 대상 식별.",
          "confidence_score": 95
        },
        {
          "clause": "10.2",
          "summary": "불량 원인 규명 및 이물 재발 방지를 위한 시정 조치 프로세스 개시 필요.",
          "confidence_score": 90
        }
      ]
    },
    "metadata": {
      "template_type": "ISO9001",
      "org_name": "Hyundai",
      "complexity": "medium"
    }
  },
  {
    "id": "mapping-009",
    "input": [
      {
        "process_name": "포장",
        "quantity": 143,
        "defect_code": "D-005",
        "notes": "포장 공정에서 총 143건의 데이터 수집."
      },
      {
        "process_name": "압출",
        "quantity": 156,
        "notes": "압출 공정에서 총 156건의 데이터 수집."
      },
      {
        "process_name": "조립",
        "quantity": 169,
        "notes": "조립 공정에서 총 169건의 데이터 수집."
      },
      {
        "process_name": "도색",
        "quantity": 182,
        "defect_code": "D-003",
        "notes": "도색 공정에서 총 182건의 데이터 수집."
      }
    ],
    "expected": {
      "sections": [
        {
          "clause": "8.5.1",
          "summary": "LG 템플릿 기준 압출 공정의 정상 생산 수량 156건에 대한 적합성 관리 승인.",
          "confidence_score": 98
        },
        {
          "clause": "8.7",
          "summary": "LG 템플릿 기준 포장 공정에서 발생한 이물 불량(D-005) 건에 대한 통제 조치 대상 식별.",
          "confidence_score": 95
        },
        {
          "clause": "10.2",
          "summary": "불량 원인 규명 및 이물 재발 방지를 위한 시정 조치 프로세스 개시 필요.",
          "confidence_score": 90
        }
      ]
    },
    "metadata": {
      "template_type": "ISO9001",
      "org_name": "LG",
      "complexity": "high"
    }
  },
  {
    "id": "mapping-010",
    "input": [
      {
        "process_name": "도색",
        "quantity": 150,
        "notes": "도색 공정에서 총 150건의 데이터 수집."
      },
      {
        "process_name": "연마",
        "quantity": 163,
        "notes": "연마 공정에서 총 163건의 데이터 수집."
      }
    ],
    "expected": {
      "sections": [
        {
          "clause": "8.5.1",
          "summary": "Standard 템플릿 기준 도색 공정의 정상 생산 수량 150건에 대한 적합성 관리 승인.",
          "confidence_score": 98
        }
      ]
    },
    "metadata": {
      "template_type": "ISO9001",
      "org_name": "Standard",
      "complexity": "low"
    }
  },
  {
    "id": "mapping-011",
    "input": [
      {
        "process_name": "검사",
        "quantity": 157,
        "notes": "검사 공정에서 총 157건의 데이터 수집."
      },
      {
        "process_name": "포장",
        "quantity": 170,
        "defect_code": "D-003",
        "notes": "포장 공정에서 총 170건의 데이터 수집."
      },
      {
        "process_name": "압출",
        "quantity": 183,
        "notes": "압출 공정에서 총 183건의 데이터 수집."
      }
    ],
    "expected": {
      "sections": [
        {
          "clause": "8.5.1",
          "summary": "Samsung 템플릿 기준 검사 공정의 정상 생산 수량 157건에 대한 적합성 관리 승인.",
          "confidence_score": 98
        },
        {
          "clause": "8.7",
          "summary": "Samsung 템플릿 기준 포장 공정에서 발생한 찍힘 불량(D-003) 건에 대한 통제 조치 대상 식별.",